{"appeal_route":"human or external-provider review","book":"Phil","candidate_only":true,"controller_event_ids":["evt-phil-r8-boss-reviewed"],"dissent":["QF-CORRELATED-SUBSTRATE","QF-GREEK-CORPUS-CLOSURE"],"identity":{"agent_instance_id":"codex-phil-boss","assignment_id":"asg-phil-r8-boss","execution_id":"exec-phil-r8-boss","provider_family":"codex-gpt5-correlated-local","role_id":"evidence_dispute_boss"},"input_manifest_sha256":"sha256:e84d6ee34939c6c2449e768e588526dab94edf15d09c9a3e00a4ada706e212bb","kind":"boss_authorization","non_authorizing":true,"packet_sha256":"sha256:3747678ecd74769a5590750fdd9369c40ced3cd795bef6c410d9007916be4d3d","rationale":"Receipt-only candidate packet; corpus-level Greek limitations and correlated substrate remain held.","redteam_digest":"sha256:5a88384d7695cb12679f2db313d6a3387a61df44edeb72c564b60fa7392b6bc1","rejected_alternatives":["promote boundaries","treat corpus rows as independent votes"],"run_id":"phil-r8-held-1","schema_version":"whole_bible_b01_boss_authorization.v2","stage_attempt_id":"b01-controller-1","verdict":"GO_B01_RECEIPT_ONLY"}