{"appeal_route":"human or external-provider review","book":"Phlm","candidate_only":true,"controller_event_ids":["evt-phlm-r8-boss-reviewed"],"dissent":["QF-CORRELATED-SUBSTRATE","QF-GREEK-CORPUS-CLOSURE"],"identity":{"agent_instance_id":"codex-phlm-boss","assignment_id":"asg-phlm-r8-boss","execution_id":"exec-phlm-r8-boss","provider_family":"codex-gpt5-correlated-local","role_id":"evidence_dispute_boss"},"input_manifest_sha256":"sha256:8ea48374ce8d1431dd9d3237a03cd8e2a133f6cb212d9914fb03177c78d60fc3","kind":"boss_authorization","non_authorizing":true,"packet_sha256":"sha256:27592a1481eacf5d0a1c9d39eaadf7279b613c75cb53594ae2fb65248d3757fe","rationale":"Receipt-only candidate packet; corpus-level Greek limitations and correlated substrate remain held.","redteam_digest":"sha256:5fb8ebcfe14da0815b9f0bc5c88750f779378d80a8880301241c64dbc945f924","rejected_alternatives":["promote boundaries","treat corpus rows as independent votes"],"run_id":"phlm-r8-held-1","schema_version":"whole_bible_b01_boss_authorization.v2","stage_attempt_id":"b01-controller-1","verdict":"GO_B01_RECEIPT_ONLY"}