{"appeal_route":"human or external-provider review","book":"Jonah","candidate_only":true,"controller_event_ids":["evt-jonah-r8-boss-reviewed"],"dissent":["QF-CORRELATED-SUBSTRATE","QF-ANCIENT-CONTEXT-GAP"],"identity":{"agent_instance_id":"codex-jonah-boss","assignment_id":"asg-jonah-r8-boss","execution_id":"exec-jonah-r8-boss","provider_family":"codex-gpt5-correlated-local","role_id":"evidence_dispute_boss"},"input_manifest_sha256":"sha256:bd15fe4afafdd4427f7d0dfd04e6121785e6ec253aa52f4a8342617ab7b8e746","kind":"boss_authorization","non_authorizing":true,"packet_sha256":"sha256:4ff156fd640555f821f0fa9002aba69a149dc296b3cb8c2e676c2c8e3da607db","rationale":"Candidate observations are structurally bound, but correlated substrate and unqualified ancient-context evidence require holds.","redteam_digest":"sha256:0413be5d266dfdc2e1c7cb112909565435767f76c8cfb6889e7b7dcf430bba9d","rejected_alternatives":["promote boundaries","count correlated reports as independent","simulate ancient context"],"run_id":"jonah-r8-held-1","schema_version":"whole_bible_b01_boss_authorization.v2","stage_attempt_id":"b01-controller-1","verdict":"GO_B01_RECEIPT_ONLY"}